{
  "$schema": "schema.json",
  "id": "nl.marvinschenkel.kodi",
  "name": {
    "en": "Kodi for Homey",
    "nl": "Kodi voor Homey"
  },
  "description": {
    "en": "Control your Kodi device with Homey!",    
    "nl": "Bestuur je Kodi apparaat met Homey!"
  },
  "version": "1.1.1",
  "compatibility": ">=0.8.24 || 1.x",
  "category": [
    "music",
    "video"
  ],
  "author": {
    "name": "Marvin Schenkel",
    "email": "marvinschenkel@gmail.com",
    "website": "https://linkedin.com/in/marvinschenkel"
  },
  "speech":[
    {
      "id": "kodi_play_movie",
      "importance": 1,
      "triggers" : {
        "en" : ["play movie"],
        "nl" : ["speel film", "speel de film"]
      }
    },
    {
      "id": "kodi_play_tvshow",
      "importance": 1,
      "triggers" : {
        "en" : ["play tv show"],
        "nl" : ["speel serie", "speel de serie"]
      }
    },
    {
      "id": "kodi_play_music",
      "importance": 1,
      "triggers" : {
        "en" : ["play music"],
        "nl": ["speel muziek"]
      }
    },
    {
      "id": "kodi_play_pause",
      "importance": 1,
      "triggers" : {
        "en" : ["pause", "resume"],
        "nl" : ["pauze", "speel", "hervat"]
      }
    },
    {
      "id": "kodi_stop",
      "importance": 0.7,
      "triggers" : {
        "en" : ["stop", "exit", "quit"],
        "nl": ["stop"]
      }
    },
    {
      "id": "kodi_next",
      "importance": 0.7,
      "triggers": {
        "en" : ["next track"],
        "nl": ["volgende"]
      }
    },
    {
      "id": "kodi_previous",
      "importance": 0.7,
      "triggers": {
        "en" : ["previous track"],
        "nl": ["vorige"]
      }
    },
    {
       "id": "kodi_play_latest_episode",
       "importance": 1,
       "triggers": {
         "en": ["play latest episode of", "play the latest episode of", "play latest episode", "play latest episode of"],
         "nl": ["speel de laatste aflevering", "speel de laatste aflevering van", "speel laatste aflevering"]
       }
    }
  ],
  "drivers": [
    {
      "id": "kodi",
      "name": {
        "en": "Kodi"
      },
      "images": {
        "large": "./drivers/kodi/assets/images/large.png",
        "small": "./drivers/kodi/assets/images/small.png"
      },
      "class": "videoplayer",
      "capabilities": [ "play", "pause", "stop" ],
      "pair": [
        {
          "id": "configure_kodi"
        }
        ,
        {
          "id": "add_kodis",
          "template": "add_devices"
        }
      ],
      "settings": [
        {
          "type": "group",
          "label": {
            "en": "Kodi settings",
            "nl": "Kodi instellingen"
          },
          "children": [
            {
              "id": "host",
              "type": "text",
              "label": {
                "en": "(Local) IP Address of Kodi",
                "nl": "(Lokale) IP adres van Kodi"
              }
            },
            {
              "id": "tcpport",
              "type": "text",
              "label": {
                "en": "TCP Port",
                "nl": "TCP Poort"
              }
            }
          ]
        }
      ]
    }
  ],
  "images":{
    "large":"./assets/images/large.png",
    "small":"./assets/images/small.png"
  },
  "flow":	{
    "triggers":[
      {
        "id":"kodi_movie_start",
        "title": {
          "en":"A movie has started",          
          "nl":"Een film begint"
        },
        "args": [
          {
            "name": "kodi",
            "type": "device",
            "filter": "driver_uri=homey:app:nl.marvinschenkel.kodi&driver_id=kodi",
            "placeholder": { 
              "en": "Which Kodi device", 
              "nl": "Welk Kodi apparaat" 
             }
          }
        ],
        "tokens":[
          {
            "name":"movie_title",
            "title": {
              "en":"Title",
              "nl":"Titel"
            },
            "example":{
              "en":"Finding Nemo",
              "nl":"Finding Nemo"
            }
          }
        ]
      },
      {
        "id":"kodi_episode_start",
        "title": {
          "en":"An episode has started",
          "nl":"Een aflevering begint"
        },
        "args": [
          {
            "name": "kodi",
            "type": "device",
            "filter": "driver_uri=homey:app:nl.marvinschenkel.kodi&driver_id=kodi"
          }
        ],
        "tokens":[
          {
            "name":"tvshow_title",
            "title": {
              "en":"Show",
              "nl":"Serie"
            },
            "example":{
              "en":"The Walking Dead",
              "nl":"The Walking Dead"
            }
          },
          {
            "name":"episode_title",
            "title": {
              "en":"Episode",
              "nl":"Aflevering"
            },
            "example":{
              "en":"First Time Again",
              "nl":"First Time Again"
            }
          },
          {
            "name":"season",
            "title": {
              "en":"Sea #",
              "nl":"Sei #"
            },
            "example":{
              "en":"1",
              "nl":"1"
            }
          },
          {
            "name":"episode",
            "title": {
              "en":"Ep #",
              "nl":"Afl #"
            },
            "example":{
              "en":"2",
              "nl":"2"
            }
          }
        ]
      },
      {
        "id":"kodi_pause",
        "title": {
          "en":"Kodi has been paused",
          "nl": "Kodi is gepauzeerd"
        },
        "args": [
          {
            "name": "kodi",
            "type": "device",
            "filter": "driver_uri=homey:app:nl.marvinschenkel.kodi&driver_id=kodi"
          }
        ]
      },
      {
        "id":"kodi_resume",
        "title": {
          "en":"Kodi has been resumed",
          "nl":"Kodi begint weer af te spelen"
        },
        "args": [
          {
            "name": "kodi",
            "type": "device",
            "filter": "driver_uri=homey:app:nl.marvinschenkel.kodi&driver_id=kodi"
          }
        ]
      },
      {
        "id":"kodi_stop",        
        "title": {
          "en":"Kodi has been stopped",
          "nl": "Kodi is gestopt"
        },
        "args": [
          {
            "name": "kodi",
            "type": "device",
            "filter": "driver_uri=homey:app:nl.marvinschenkel.kodi&driver_id=kodi"
          }
        ]
      }
    ],
    "actions":[
      {
        "id": "play_movie_kodi",
        "title": {
          "en" : "Play a movie on Kodi",
          "nl":"Speel een film af op Kodi"
        },
        "fluidArgs": true,
        "args":[
          {
            "name": "kodi",
            "type": "device",
            "filter": "driver_uri=homey:app:nl.marvinschenkel.kodi&driver_id=kodi"
          },
          {
            "name": "movie_title",
            "type": "text",
            "placeholder" : {
              "en" : "Type a movie title that's in your library",
              "nl": "Voer een film uit je bibliotheek in"
            }
          }
        ]
      },
      {
        "id": "pause_resume_kodi",
        "title": {
          "en" : "Pause / resume playback on Kodi",
          "nl" : "Pauzeer / hervat Kodi"
        },
        "fluidArgs": true,
        "args":[
          {
            "name": "kodi",
            "type": "device",
            "filter": "driver_uri=homey:app:nl.marvinschenkel.kodi&driver_id=kodi"
          }
        ]
      },
      {
        "id": "stop_kodi",
        "title": {
          "en" : "Stop playback on Kodi",
          "nl" : "Stop afspelen op Kodi"
        },
        "fluidArgs": true,
        "args":[
          {
            "name": "kodi",
            "type": "device",
            "filter": "driver_uri=homey:app:nl.marvinschenkel.kodi&driver_id=kodi"
          }
        ]
      }
    ]
  }
  ,
  "permissions": [
    "homey:manager:speech-output",
    "homey:manager:speech-input",
    "homey:manager:ledring"
  ]
}
